results/metricas_modelos.csv

modelo,accuracy,precision_macro,recall_macro,f1_macro,latencia_total_s,latencia_media_s_por_texto,n_evaluacion,dispositivo
MoritzLaurer/mDeBERTa-v3-base-mnli-xnli,0.6222222222222222,0.6195652173913043,0.6222222222222221,0.5894117647058824,2.393591124000068,0.053190913866668174,45,GPU
joeddav/xlm-roberta-large-xnli,0.6222222222222222,0.6294444444444445,0.6222222222222222,0.6069632981397687,2.6990548720000334,0.059978997155556296,45,GPU
MoritzLaurer/DeBERTa-v3-base-mnli-fever-anli,0.35555555555555557,0.4688405797101449,0.3555555555555555,0.3233682983682984,0.7734588829999893,0.01718797517777754,45,GPU

README.md

## 10. Resultados y comparación

Modelo: joeddav/xlm-roberta-large-xnli
Accuracy: 0.6222
Precision Macro: 0.6294
Recall Macro: 0.6222
F1 Macro: 0.6070
Latencia media: 0.0432 segundos por texto
Dispositivo: GPU

Modelo: MoritzLaurer/mDeBERTa-v3-base-mnli-xnli
Accuracy: 0.6222
Precision Macro: 0.6196
Recall Macro: 0.6222
F1 Macro: 0.5894
Latencia media: 0.0181 segundos por texto
Dispositivo: GPU

Modelo: MoritzLaurer/DeBERTa-v3-base-mnli-fever-anli
Accuracy: 0.3556
Precision Macro: 0.4688
Recall Macro: 0.3556
F1 Macro: 0.3234
Latencia media: 0.0188 segundos por texto
Dispositivo: GPU

Rendimiento predictivo: joeddav/xlm-roberta-large-xnli obtuvo el mejor F1 macro general, con un valor de 0.6070, aunque presentó un coste computacional y una latencia mayores, de 0.0432 segundos por texto.

## 13. Conclusiones

joeddav/xlm-roberta-large-xnli obtuvo el mejor desempeño predictivo general con un F1 macro de 0.6070, mientras que MoritzLaurer/mDeBERTa-v3-base-mnli-xnli demostró mayor eficiencia temporal con una latencia media de 0.0181 s por texto.